{
  "version": 1,
  "updatedAt": "2026-10-17T23:40:44.157Z",
  "source": "https://github.com/opspresso/agent-models",
  "providers": [
    "openai",
    "anthropic",
    "google",
    "xai",
    "bedrock",
    "openrouter"
  ],
  "makers": {
    "openai": "OpenAI",
    "anthropic": "Anthropic",
    "google": "Google",
    "xai": "xAI",
    "deepseek": "DeepSeek",
    "zhipu": "Z.ai",
    "minimax": "MiniMax",
    "moonshot": "Moonshot AI",
    "qwen": "Alibaba Qwen",
    "nvidia": "NVIDIA",
    "xiaomimimo": "Xiaomi",
    "tencent": "Tencent",
    "stepfun": "StepFun",
    "upstage": "Upstage",
    "bytedance-seed": "ByteDance Seed",
    "black-forest-labs": "Black Forest Labs",
    "microsoft": "Microsoft",
    "krea": "Krea",
    "baai": "BAAI",
    "perplexity": "Perplexity",
    "sentence-transformers": "Sentence Transformers",
    "mistralai": "Mistral",
    "voyageai": "VoyageAI by MongoDB",
    "intfloat": "Intfloat",
    "cohere": "Cohere",
    "deepgram": "Deepgram",
    "fish-audio": "Fish Audio",
    "meta": "Meta",
    "recraft": "Recraft",
    "assemblyai": "AssemblyAI",
    "typesafe": "TypeSafe",
    "jaredpalmer": "Jared Palmer",
    "togethercomputer": "Together",
    "liquid": "LiquidAI",
    "cloudflare": "Cloudflare",
    "elevenlabs": "ElevenLabs",
    "inception": "Inception",
    "nace-ai": "Nace.AI",
    "scaledown": "ScaleDown",
    "respan": "Respan"
  },
  "models": [
    {
      "id": "openai/gpt-5.6-sol",
      "provider": "openai",
      "family": "gpt-5.6-sol",
      "maker": "openai",
      "displayName": "GPT-5.6 Sol",
      "pricing": {
        "inputPer1M": 4,
        "outputPer1M": 20,
        "cachedInputPer1M": 0.4
      },
      "capabilities": {
        "tools": true,
        "structuredOutput": true,
        "imageInput": true,
        "reasoning": true,
        "reasoningWithTools": false
      },
      "contextWindow": 1050000,
      "maxTokens": 128000
    },
    {
      "id": "openai/gpt-5.6-terra",
      "provider": "openai",
      "family": "gpt-5.6-terra",
      "maker": "openai",
      "displayName": "GPT-5.6 Terra",
      "pricing": {
        "inputPer1M": 2,
        "outputPer1M": 12,
        "cachedInputPer1M": 0.2
      },
      "capabilities": {
        "tools": true,
        "structuredOutput": true,
        "imageInput": true,
        "reasoning": true,
        "reasoningWithTools": false
      },
      "contextWindow": 1050000,
      "maxTokens": 128000
    },
    {
      "id": "openai/gpt-5.6-luna",
      "provider": "openai",
      "family": "gpt-5.6-luna",
      "maker": "openai",
      "displayName": "GPT-5.6 Luna",
      "pricing": {
        "inputPer1M": 0.2,
        "outputPer1M": 1.2,
        "cachedInputPer1M": 0.02
      },
      "capabilities": {
        "tools": true,
        "structuredOutput": true,
        "imageInput": true,
        "reasoning": true,
        "reasoningWithTools": false
      },
      "contextWindow": 1050000,
      "maxTokens": 128000
    },
    {
      "id": "openai/gpt-5.4",
      "provider": "openai",
      "family": "gpt-5.4",
      "maker": "openai",
      "displayName": "GPT-5.4",
      "pricing": {
        "inputPer1M": 2.5,
        "outputPer1M": 15,
        "cachedInputPer1M": 0.25
      },
      "capabilities": {
        "tools": true,
        "structuredOutput": true,
        "imageInput": true,
        "reasoning": true
      },
      "contextWindow": 1050000,
      "maxTokens": 128000
    },
    {
      "id": "openai/gpt-5.4-mini",
      "provider": "openai",
      "family": "gpt-5.4-mini",
      "maker": "openai",
      "displayName": "GPT 5.4 Mini",
      "pricing": {
        "inputPer1M": 0.75,
        "outputPer1M": 4.5,
        "cachedInputPer1M": 0.075
      },
      "capabilities": {
        "tools": true,
        "structuredOutput": true,
        "imageInput": true,
        "reasoning": true
      },
      "contextWindow": 400000,
      "maxTokens": 128000
    },
    {
      "id": "openai/gpt-5.1",
      "provider": "openai",
      "family": "gpt-5.1",
      "maker": "openai",
      "displayName": "GPT-5.1",
      "pricing": {
        "inputPer1M": 1.25,
        "outputPer1M": 10,
        "cachedInputPer1M": 0.125
      },
      "capabilities": {
        "tools": true,
        "structuredOutput": true,
        "imageInput": true,
        "reasoning": true
      },
      "contextWindow": 400000,
      "maxTokens": 128000,
      "hidden": true
    },
    {
      "id": "openai/gpt-5-mini",
      "provider": "openai",
      "family": "gpt-5-mini",
      "maker": "openai",
      "displayName": "GPT 5 Mini",
      "pricing": {
        "inputPer1M": 0.25,
        "outputPer1M": 2,
        "cachedInputPer1M": 0.025
      },
      "capabilities": {
        "tools": true,
        "structuredOutput": true,
        "imageInput": true,
        "reasoning": true
      },
      "contextWindow": 400000,
      "maxTokens": 128000,
      "hidden": true
    },
    {
      "id": "openai/gpt-image-2",
      "provider": "openai",
      "family": "gpt-image-2",
      "maker": "openai",
      "displayName": "GPT Image 2",
      "pricing": {
        "inputPer1M": 5,
        "outputPer1M": 0,
        "cachedInputPer1M": 1.25,
        "imageInputPer1M": 8,
        "imageOutputPer1M": 30
      },
      "capabilities": {
        "tools": false,
        "structuredOutput": false,
        "imageInput": true,
        "reasoning": false,
        "imageGeneration": true
      },
      "contextWindow": 400000,
      "maxTokens": 128000
    },
    {
      "id": "openai/gpt-5.5-pro",
      "provider": "openai",
      "family": "gpt-5.5-pro",
      "maker": "openai",
      "displayName": "GPT-5.5 Pro",
      "pricing": {
        "inputPer1M": 30,
        "outputPer1M": 180
      },
      "capabilities": {
        "tools": true,
        "structuredOutput": true,
        "imageInput": true,
        "reasoning": true
      },
      "contextWindow": 1050000,
      "maxTokens": 128000
    },
    {
      "id": "openai/gpt-5.5",
      "provider": "openai",
      "family": "gpt-5.5",
      "maker": "openai",
      "displayName": "GPT-5.5",
      "pricing": {
        "inputPer1M": 5,
        "outputPer1M": 30,
        "cachedInputPer1M": 0.5
      },
      "capabilities": {
        "tools": true,
        "structuredOutput": true,
        "imageInput": true,
        "reasoning": true
      },
      "contextWindow": 1050000,
      "maxTokens": 128000
    },
    {
      "id": "openai/gpt-5.4-nano",
      "provider": "openai",
      "family": "gpt-5.4-nano",
      "maker": "openai",
      "displayName": "GPT-5.4 Nano",
      "pricing": {
        "inputPer1M": 0.2,
        "outputPer1M": 1.25,
        "cachedInputPer1M": 0.02
      },
      "capabilities": {
        "tools": true,
        "structuredOutput": true,
        "imageInput": true,
        "reasoning": true
      },
      "contextWindow": 400000,
      "maxTokens": 128000
    },
    {
      "id": "openai/gpt-5.4-pro",
      "provider": "openai",
      "family": "gpt-5.4-pro",
      "maker": "openai",
      "displayName": "GPT-5.4 Pro",
      "pricing": {
        "inputPer1M": 30,
        "outputPer1M": 180
      },
      "capabilities": {
        "tools": true,
        "structuredOutput": true,
        "imageInput": true,
        "reasoning": true
      },
      "contextWindow": 1050000,
      "maxTokens": 128000
    },
    {
      "id": "openai/gpt-5.3-codex",
      "provider": "openai",
      "family": "gpt-5.3-codex",
      "maker": "openai",
      "displayName": "GPT-5.3-Codex",
      "pricing": {
        "inputPer1M": 1.75,
        "outputPer1M": 14,
        "cachedInputPer1M": 0.175
      },
      "capabilities": {
        "tools": true,
        "structuredOutput": true,
        "imageInput": true,
        "reasoning": true
      },
      "contextWindow": 400000,
      "maxTokens": 128000
    },
    {
      "id": "openai/gpt-audio",
      "provider": "openai",
      "family": "gpt-audio",
      "maker": "openai",
      "displayName": "GPT Audio",
      "pricing": {
        "inputPer1M": 2.5,
        "outputPer1M": 10
      },
      "capabilities": {
        "tools": true,
        "structuredOutput": true,
        "imageInput": false,
        "reasoning": false
      },
      "contextWindow": 128000,
      "maxTokens": 16384
    },
    {
      "id": "openai/gpt-audio-mini",
      "provider": "openai",
      "family": "gpt-audio-mini",
      "maker": "openai",
      "displayName": "GPT Audio Mini",
      "pricing": {
        "inputPer1M": 0.6,
        "outputPer1M": 2.4
      },
      "capabilities": {
        "tools": true,
        "structuredOutput": true,
        "imageInput": false,
        "reasoning": false
      },
      "contextWindow": 128000,
      "maxTokens": 16384
    },
    {
      "id": "openai/gpt-5.2-codex",
      "provider": "openai",
      "family": "gpt-5.2-codex",
      "maker": "openai",
      "displayName": "GPT-5.2-Codex",
      "pricing": {
        "inputPer1M": 1.75,
        "outputPer1M": 14,
        "cachedInputPer1M": 0.175
      },
      "capabilities": {
        "tools": true,
        "structuredOutput": true,
        "imageInput": true,
        "reasoning": true
      },
      "contextWindow": 400000,
      "maxTokens": 128000
    },
    {
      "id": "openai/gpt-5.2-pro",
      "provider": "openai",
      "family": "gpt-5.2-pro",
      "maker": "openai",
      "displayName": "GPT-5.2 Pro",
      "pricing": {
        "inputPer1M": 21,
        "outputPer1M": 168
      },
      "capabilities": {
        "tools": true,
        "structuredOutput": true,
        "imageInput": true,
        "reasoning": true
      },
      "contextWindow": 400000,
      "maxTokens": 128000
    },
    {
      "id": "openai/gpt-5.2",
      "provider": "openai",
      "family": "gpt-5.2",
      "maker": "openai",
      "displayName": "GPT-5.2",
      "pricing": {
        "inputPer1M": 1.75,
        "outputPer1M": 14,
        "cachedInputPer1M": 0.175
      },